{
  "schema_version": 1,
  "model_version": 1,
  "metadata": {
    "name": "operating-scenario",
    "description": "Named assumptions feed revenue, profit, and break-even."
  },
  "provenance": {
    "origin": "authored",
    "source": "operating-scenario"
  },
  "bindings": {
    "inputs": {
      "unit_price": {
        "sheet": "Assumptions",
        "address": "B1"
      },
      "unit_cost": {
        "sheet": "Assumptions",
        "address": "B2"
      },
      "fixed_cost": {
        "sheet": "Assumptions",
        "address": "B3"
      }
    },
    "outputs": {
      "revenue": {
        "sheet": "Forecast",
        "address": "F2"
      },
      "profit": {
        "sheet": "Forecast",
        "address": "F3"
      },
      "break_even_units": {
        "sheet": "Forecast",
        "address": "F4"
      },
      "division_error": {
        "sheet": "Forecast",
        "address": "F5"
      },
      "unsupported_probe": {
        "sheet": "Forecast",
        "address": "J1"
      },
      "parse_probe": {
        "sheet": "Forecast",
        "address": "J2"
      }
    }
  },
  "sheets": [
    {
      "name": "Assumptions",
      "dimensions": [
        1,
        3,
        1,
        3
      ],
      "cells": {
        "A1": {
          "address": "A1",
          "value": "Unit price",
          "data_type": "text"
        },
        "B1": {
          "address": "B1",
          "value": 20,
          "data_type": "number",
          "number_format": "$#,##0.00;[Red]($#,##0.00)",
          "provenance": {
            "origin": "authored",
            "source": "named-assumption"
          }
        },
        "C1": {
          "address": "C1",
          "value": true,
          "data_type": "boolean"
        },
        "A2": {
          "address": "A2",
          "value": "Unit variable cost",
          "data_type": "text"
        },
        "B2": {
          "address": "B2",
          "value": 8,
          "data_type": "number",
          "number_format": "$#,##0.00;[Red]($#,##0.00)"
        },
        "A3": {
          "address": "A3",
          "value": "Fixed cost per period",
          "data_type": "text"
        },
        "B3": {
          "address": "B3",
          "value": 1000,
          "data_type": "number",
          "number_format": "$#,##0.00;[Red]($#,##0.00)"
        },
        "C3": {
          "address": "C3",
          "value": {
            "error": "#REF!",
            "message": null
          },
          "data_type": "error"
        }
      }
    },
    {
      "name": "Forecast",
      "dimensions": [
        1,
        5,
        1,
        10
      ],
      "cells": {
        "A1": {
          "address": "A1",
          "value": "Period",
          "data_type": "text"
        },
        "B1": {
          "address": "B1",
          "value": "Quantity",
          "data_type": "text"
        },
        "C1": {
          "address": "C1",
          "value": "Revenue",
          "data_type": "text"
        },
        "D1": {
          "address": "D1",
          "value": "Variable costs",
          "data_type": "text"
        },
        "E1": {
          "address": "E1",
          "value": "Profit",
          "data_type": "text"
        },
        "F1": {
          "address": "F1",
          "value": "Summary outputs",
          "data_type": "text"
        },
        "A2": {
          "address": "A2",
          "value": "Period 1",
          "data_type": "text"
        },
        "B2": {
          "address": "B2",
          "value": 100,
          "data_type": "number"
        },
        "C2": {
          "address": "C2",
          "value": null,
          "data_type": "blank",
          "formula": {
            "expression": "=B2*Assumptions!$B$1",
            "dependencies": [],
            "result": null
          },
          "number_format": "$#,##0.00;[Red]($#,##0.00)"
        },
        "D2": {
          "address": "D2",
          "value": null,
          "data_type": "blank",
          "formula": {
            "expression": "=B2*Assumptions!$B$2",
            "dependencies": [],
            "result": null
          },
          "number_format": "$#,##0.00;[Red]($#,##0.00)"
        },
        "E2": {
          "address": "E2",
          "value": null,
          "data_type": "blank",
          "formula": {
            "expression": "=C2-D2-Assumptions!$B$3",
            "dependencies": [],
            "result": null
          },
          "number_format": "$#,##0.00;[Red]($#,##0.00)"
        },
        "G2": {
          "address": "G2",
          "value": "Total revenue",
          "data_type": "text"
        },
        "A3": {
          "address": "A3",
          "value": "Period 2",
          "data_type": "text"
        },
        "B3": {
          "address": "B3",
          "value": 120,
          "data_type": "number"
        },
        "C3": {
          "address": "C3",
          "value": null,
          "data_type": "blank",
          "formula": {
            "expression": "=B3*Assumptions!$B$1",
            "dependencies": [],
            "result": null
          },
          "number_format": "$#,##0.00;[Red]($#,##0.00)"
        },
        "D3": {
          "address": "D3",
          "value": null,
          "data_type": "blank",
          "formula": {
            "expression": "=B3*Assumptions!$B$2",
            "dependencies": [],
            "result": null
          },
          "number_format": "$#,##0.00;[Red]($#,##0.00)"
        },
        "E3": {
          "address": "E3",
          "value": null,
          "data_type": "blank",
          "formula": {
            "expression": "=C3-D3-Assumptions!$B$3",
            "dependencies": [],
            "result": null
          },
          "number_format": "$#,##0.00;[Red]($#,##0.00)"
        },
        "G3": {
          "address": "G3",
          "value": "Total profit",
          "data_type": "text"
        },
        "A4": {
          "address": "A4",
          "value": "Period 3",
          "data_type": "text"
        },
        "B4": {
          "address": "B4",
          "value": 150,
          "data_type": "number"
        },
        "C4": {
          "address": "C4",
          "value": null,
          "data_type": "blank",
          "formula": {
            "expression": "=B4*Assumptions!$B$1",
            "dependencies": [],
            "result": null
          },
          "number_format": "$#,##0.00;[Red]($#,##0.00)"
        },
        "D4": {
          "address": "D4",
          "value": null,
          "data_type": "blank",
          "formula": {
            "expression": "=B4*Assumptions!$B$2",
            "dependencies": [],
            "result": null
          },
          "number_format": "$#,##0.00;[Red]($#,##0.00)"
        },
        "E4": {
          "address": "E4",
          "value": null,
          "data_type": "blank",
          "formula": {
            "expression": "=C4-D4-Assumptions!$B$3",
            "dependencies": [],
            "result": null
          },
          "number_format": "$#,##0.00;[Red]($#,##0.00)"
        },
        "G4": {
          "address": "G4",
          "value": "Break-even units per period",
          "data_type": "text"
        },
        "F2": {
          "address": "F2",
          "value": null,
          "data_type": "blank",
          "formula": {
            "expression": "=SUM(C2:C4)",
            "dependencies": [],
            "result": null
          },
          "number_format": "$#,##0.00;[Red]($#,##0.00)"
        },
        "F3": {
          "address": "F3",
          "value": null,
          "data_type": "blank",
          "formula": {
            "expression": "=SUM(E2:E4)",
            "dependencies": [],
            "result": null
          },
          "number_format": "$#,##0.00;[Red]($#,##0.00)"
        },
        "F4": {
          "address": "F4",
          "value": null,
          "data_type": "blank",
          "formula": {
            "expression": "=IF(Assumptions!B1>Assumptions!B2,Assumptions!B3/(Assumptions!B1-Assumptions!B2),NA())",
            "dependencies": [],
            "result": null
          },
          "number_format": "0.00"
        },
        "F5": {
          "address": "F5",
          "value": null,
          "data_type": "blank",
          "formula": {
            "expression": "=1/0",
            "dependencies": [],
            "result": null
          }
        },
        "J1": {
          "address": "J1",
          "value": null,
          "data_type": "blank",
          "formula": {
            "expression": "=NOW()",
            "dependencies": [],
            "result": null
          }
        },
        "J2": {
          "address": "J2",
          "value": null,
          "data_type": "blank",
          "formula": {
            "expression": "=1+",
            "dependencies": [],
            "result": null
          }
        }
      }
    }
  ]
}
